{
  "$schema": "../../../schemas/room_type_schema.json",
  "id": "combat_standard",
  "displayName": "Combat Chamber",
  "enemyDensity": 2,
  "hasPortal": false,
  "hasPuzzle": false,
  "hasShop": false,
  "lootTier": 1,
  "terrainDensity": 2,
  "allowedBiomes": ["any"],
  "spawnableEnemyTags": ["grounded", "aerial"],
  "environmentHazards": [],
  "minRoomSize": [48, 48],
  "requiresTemplate": true
}
