{
  "$schema": "../../../schemas/room_type_schema.json",
  "id": "platform",
  "displayName": "Platform Challenge",
  "enemyDensity": 1,
  "hasPortal": false,
  "hasPuzzle": false,
  "hasShop": false,
  "lootTier": 1,
  "terrainDensity": 1,
  "allowedBiomes": ["any"],
  "spawnableEnemyTags": ["aerial"],
  "environmentHazards": [],
  "minRoomSize": [32, 48],
  "requiresTemplate": false
}
