{
  "$schema": "../../../schemas/room_type_schema.json",
  "id": "platform_ascent",
  "displayName": "Platform Ascent",
  "enemyDensity": 1,
  "hasPortal": false,
  "hasPuzzle": false,
  "hasShop": false,
  "lootTier": 1,
  "terrainDensity": 1,
  "allowedBiomes": ["any"],
  "spawnableEnemyTags": ["aerial"],
  "environmentHazards": [],
  "minRoomSize": [64, 96],
  "requiresTemplate": true
}
