{
  "$schema": "../../../schemas/room_type_schema.json",
  "id": "treasure",
  "displayName": "Vault",
  "enemyDensity": 0,
  "hasPortal": false,
  "hasPuzzle": false,
  "hasShop": false,
  "lootTier": 2,
  "terrainDensity": 3,
  "allowedBiomes": ["any"],
  "spawnableEnemyTags": [],
  "environmentHazards": [],
  "minRoomSize": [32, 32],
  "requiresTemplate": false
}
