{
  "$schema": "../../../schemas/room_type_schema.json",
  "id": "start",
  "displayName": "Entry Chamber",
  "enemyDensity": 0,
  "hasPortal": false,
  "hasPuzzle": false,
  "hasShop": false,
  "lootTier": 0,
  "terrainDensity": 0,
  "allowedBiomes": ["any"],
  "spawnableEnemyTags": [],
  "environmentHazards": [],
  "minRoomSize": [32, 32],
  "requiresTemplate": false
}
