{
  "$schema": "../../../schemas/room_type_schema.json",
  "id": "trial",
  "displayName": "Trial Chamber",
  "enemyDensity": 2,
  "hasPortal": false,
  "hasPuzzle": true,
  "hasShop": false,
  "lootTier": 1,
  "terrainDensity": 1,
  "allowedBiomes": ["any"],
  "spawnableEnemyTags": ["grounded"],
  "environmentHazards": [],
  "minRoomSize": [32, 32],
  "requiresTemplate": false
}
